title,address,area,price,number_bedroom,number_wc,number_floor,direction,entrance,facade,number_parking,id_estate
Khu căn hộ sở hữu tiện ích đẳng cấp nhất tây sài gòn chỉ với 660tr đồng,"West Gate Park, Huyện Bình Chánh, TP HCM",59,2,2,2,20,,,,,3942948
"Ch 52m2 mt sông sg, cầu phú long q12, tt 450tr sở hữu, shr, ck 1 chỉ vàng sjc","Chung cư Eden Riverside, Thị Xã Thuận An, Bình Dương",52,1.3,2,1,4,Đông nam,32,200,4,3934331
"Cần bán gấp ch 2pn view sông sg giá 1 tỷ 3 (vat), tt 450tr sở hữu ngay","Căn hộ Vista Riverside, Thị Xã Thuận An, Bình Dương",52,1.3,2,1,4,Đông nam,32,200,4,3803301
"Căn hộ thuận an thanh toán 225tr nhận nhà, có ngân hàng hỗ trợ vay","Legacy Central, Thị Xã Thuận An, Bình Dương",40,0.9,,,,Đông,,,,3942916
Thanh toán 260 triệu căn hộ nhật bản ven biển quy nhơn tỷ suất sinh lời 20%,"Takashi Ocean Suite, Thành Phố Quy Nhơn, Bình Định",40,1.4,1,1,,Đông bắc,,,,3942907
Hàng loạt chương trình tri ân khách hàng khi sở hữu căn hộ trong tháng 8 này,"EcoLife Riverside, Thành Phố Quy Nhơn, Bình Định",42,1.04,1,2,28,Tây Nam,,,,3941430
"Mua căn hộ chi cần với 350 triệu, nhận nhà ở ngay, tin được không? lh","EcoLife Riverside, Thành Phố Quy Nhơn, Bình Định",42,1.04,1,1,28,Tây Nam,,,,3941436
"Chủ nhà bán gấp 1 1pn 49m2 căn hộ đáng sống nhất q9, tt 999 triệu ký hdmb","The Ricca, Quận 9, TP HCM",49,1.68,1,1,13,Tây bắc,,,1,3923457
"Hot chỉ với 590 triệu sở hữu căn hộ 2pn, full nội thất, htls 0% 12 tháng","Housinco Premium, Huyện Thanh Trì, Hà Nội",62,2.28,2,1,31,,,,1,3941768
"Trực tiếp cđt housinco quỹ căn 2pn - 3pn - dualkey giá tốt nhất, htls 0%, ck 5%","Tân Triều, Huyện Thanh Trì, Hà Nội",94,3.44,3,2,31,,,,1,3941782
Chỉ với 135tr bạn đã sở hửu căn hộ 1pn tại vị trí vàng của thành phố thuận an,"Legacy Central, Thị Xã Thuận An, Bình Dương",42,0.9,1,1,29,,,,,3942893
Bán căn hộ nghỉ dưỡng quy nhơn tỉnh bình định,"Takashi Ocean Suite, Thành Phố Quy Nhơn, Bình Định",42,1.51,1,1,,Đông nam,,,,3942891
Bán gấp khu đô thị rose town 79 ngọc hồi quận hoàng mai 2pn 60m2. giá 1.5,"Rose Town, Quận Hoàng Mai, Hà Nội",60,1.5,2,2,,,,,,3829056
"Mua chung cư ở ngay. khu đô thị cao cấp quận hoàng mai, trả trước 450 triệu","Quận Hoàng Mai, Hà Nội",52,1.5,2,1,,,,,,3848079
Căn hộ vừa ở vừa đầu tư sinh lời cao chỉ với 567tr. gần tây sơn. lh :0968452627,"Thái Thịnh, Quận Đống Đa, Hà Nội",56,0.566,,,,Đông,,,,3851636
Cần bán. chung cư khu đô thị rose town quận hoàng mai căn góc. giá 1.9 tỷ,"Quận Hoàng Mai, Hà Nội",76,1.9,3,2,,,,,,3830380
"Chỉ 300tr sở hữu ngay căn hộ the ruby , view vịnh hạ long .","Phường Hà Khánh, Thành Phố Hạ Long, Quảng Ninh",70,2.3,3,2,,Tây bắc,,,,3942881
"Căn hộ biển siêu hót, sổ đỏ lâu dài tại thành phố quy nhơn chỉ 35tr/m2","Takashi Ocean Suite, Thành Phố Quy Nhơn, Bình Định",40,0.278,1,1,,,,,,3942455
Căn hộ biển - sổ đỏ lâu dài phong cách nhật tại kỳ co eo gió,"Takashi Ocean Suite, Thành Phố Quy Nhơn, Bình Định",40,0.278,,,39,,,,,3939517
Sở hữu căn hộ biển - sổ đỏ lâu dài tại kỳ co eo gió chỉ với 278 triệu,"Takashi Ocean Suite, Thành Phố Quy Nhơn, Bình Định",45,0.278,,,,,,,,3939520
Housinco premium mở bán quỹ căn mới & chính sách ưu đãi trong tháng 8 cho kh,"Housinco Premium, Huyện Thanh Trì, Hà Nội",93,3.3,3,2,,Đông nam,,,3,3942865
Kđt rose town tâm điểm phái nam hà nội liên tục ra mắt các căn hộ mới,"Rose Town, Quận Hoàng Mai, Hà Nội",92,2.5,3,2,,Đông nam,,,3,3942857
Căn hộ chung cư cao cấp 3pn toà nhà l2 ciputra,"Phường Xuân Đỉnh, Quận Bắc Từ Liêm, Hà Nội",155,8.5,3,3,,,,,1,3942856
Căn hộ 4 ngủ trong mơ - ưu đãi bất ngờ - tiến độ đóng trong 2 năm tại hpc,"HPC Landmark Tower, Quận Hà Đông, Hà Nội",135,3,4,3,,Đông bắc,,,2,3942855
Chung cư mini đình thôn 56m2 x 5 tầng - 11 phòng khép kín giá 5.6 tỷ.,"Quận Nam Từ Liêm, Hà Nội",56,5.6,10,,5,,,,,3938388
"Housinco premium, bốn mùa xanh mát, bàn giao nội thất cao cấp ngoại nhập","Housinco Premium, Huyện Thanh Trì, Hà Nội",75.5,2.76,2,2,31,Tây bắc,,,1,3942854
"Hơn 3,52 tỷ sở hữu căn hộ 3 pn tại hoàng mai","Feliz Homes, Quận Hoàng Mai, Hà Nội",107,3.52,3,2,27,Đông nam,,,1,3942852
Với mức lương 7tr/ tháng bạn vẫn sở hữu căn hộ ngay trung tâm tp thuận an,"Thị Xã Thuận An, Bình Dương",36,0.135,1,1,16,Đông nam,,,,3942851
Bán căn hộ ngoại giao dự án eco city việt hưng long biên hướng đông băc 72m2 2pn,"Căn hộ Eco City Việt Hưng, Quận Long Biên, Hà Nội",72,2082,2,2,7,Đông bắc,,,1,3937374
"Chỉ hơn 2,77 tỷ sở hữu căn hộ 2 pn sở hữu căn hộ cao cập tại quận hoàng mai","Feliz Homes, Quận Hoàng Mai, Hà Nội",77,2.78,2,2,27,Tây Nam,,,1,3942847
"Cần bán căn hộ 3 ngủ 104m2, hỗ trợ vay ls 0%, tố hữu - hà đông","Chung cư BID Residence, Quận Hà Đông, Hà Nội",104,2.6,3,2,,Đông bắc,,,2,3942840
"Bán căn hộ cc 379 th complex, có hỗ trợ cho vay đến 70%, trước 30% lh 0912105635","Chung cư 379 Thanh Hóa, Thành phố Thanh Hóa, Thanh Hóa",51,0.561,2,2,,,,,,3942835
"Bán căn hộ cc 379 th complex, hỗ trợ cho vay đến 70%, cọc trước 30% lh 091210563","Chung cư 379 Thanh Hóa, Thành phố Thanh Hóa, Thanh Hóa",51,0.561,2,2,,,,,,3942831
"Căn hộ trang bị smart home, thiết kế resort 5 sao, giá rẽ nhất sài gòn","Picity High Park, Quận 12, TP HCM",57,2.3,2,1,18,,25,,,3942828
"Ccmn, võ thị sáu, an sinh tuyệt đỉnh, ngõ rộng ô tô đỗ cửa, chỉ 1.55 tỷ","Quận Hai Bà Trưng, Hà Nội",52,1.55,2,2,3,,4,4,,3942058
"Siêu giá tốt, ccmn võ thị sáu, ngõ rộng ô tô đỗ cửa, chỉ 1.55 tỷ","Quận Hai Bà Trưng, Hà Nội",52,1.55,2,2,3,,4,4,,3941921
Căn hộ cho vợ chồng trẻ thanh toán 135triệu trả góp từ 5-7 triệu/tháng,"Legacy Central, Thị Xã Thuận An, Bình Dương",37,0.9,1,1,,,,,,3942824
Westgate chỉ 690 triệu sở căn hộ 5 mặt tiền ngay trung tâm hành chính,"West Gate Park, Huyện Bình Chánh, TP HCM",59,2.1,2,2,,Đông nam,,,,3942816
Bán căn hộ west gate tặng full nội thất chỉ trả 640 triệu,"West Gate Park, Huyện Bình Chánh, TP HCM",60,2.1,2,2,20,Đông nam,120,60,,3942810
Chủ đầu tư bán căn hộ 1pn the beverly vinhomes q9 cho vay 80%,"VinHomes Grand Park, Quận 9, TP HCM",55,3,1,1,25,Đông nam,30,20,,3942796
The ruby hạ long nơi ước đến chốn mong về - tâm điểm đáng sống nhất tại hạ long.,"Phường Cao Xanh, Thành Phố Hạ Long, Quảng Ninh",30,0.98,1,,,,,,,3942795
"Chính chủ bán gấp gấp căn góc 3pn, chung cư ct1a2 hud vân canh","KĐT Vân Canh HUD, Huyện Hoài Đức, Hà Nội",102,1.4,3,2,,Đông nam,,,2,3906166
"Bán căn 2pn tầng cao tây hồ residence chỉ từ 3,1 tỷ full nội thất cao cấp","Chung cư Sunshine Riverside, Quận Tây Hồ, Hà Nội",70,3.1,2,2,,,,,,3899311
"Bán căn góc 3pn chung cư the link ciputra ban đông nam 7,4tỷ full nội thất, trực","Phường Đông Ngạc, Quận Bắc Từ Liêm, Hà Nội",163,1.21,3,2,,Đông nam,,,,3896133
Chung cưtnt 120 định công chính thức đặt chỗ và cho khách lên xem căn hộ,"Phương Đông Green Park, Quận Hoàng Mai, Hà Nội",60,1.6,,,,,,,,3935953
Chính chủ cần bán căn hộ cao cấp 5 sao vinhomes grand park thành phố thủ đức:,"VinHomes Grand Park, Quận 9, TP HCM",52,1.85,2,1,1,,30,16,1,3911599
"Bán căn hộ duplex ở ngay trung tâm quận 3, 1 phòng ngủ, 1 toilet, 1 phòng khách","CÁCH MẠNG THÁNG 8, Quận 3, TP HCM",27,1.5,1,1,6,Đông nam,50,6,1,3937502
"Căn hộ 4pn full nội thất chỉ 23tr/m2, thanh toán tiến độ, 0% lãi suất","HPC Landmark Tower, Quận Hà Đông, Hà Nội",135,3,4,3,,Tây Nam,,,2,3942699
"Bạn nghĩ sao về căn chung cư 3pn tại kđt văn khê, hà đông, chỉ tt 900","Văn Khê, Quận Hà Đông, Hà Nội",143,3.1,3,3,15,,,,4,3942661
"Housinco premium mở bán quỹ căn siêu hót, chiết khấu ưu đãi, quà tặng hấp dẫn","Housinco Premium, Huyện Thanh Trì, Hà Nội",93,3.3,3,2,,,,,4,3935671
"Mở bán căn hộ ngay mặt đường nguyễn xiển, chiết khấu tới 5% gtch","Housinco Premium, Huyện Thanh Trì, Hà Nội",94,3.3,3,2,,,,,3,3932313
"Feliz homes tt q.hoàng mai mở bán căn hộ cao cấp, nhiều chính sách ưu đãi","KĐT Đền Lừ, Quận Hoàng Mai, Hà Nội",78,2.8,2,2,,,,,3,3939192
Housnco premium dự án bàn giáo full nội thất cao cấp mở bán quỹ căn mới,"Housinco Premium, Huyện Thanh Trì, Hà Nội",93,3.3,3,2,,,,,3,3942658
"Căn hộ mhd trung văn giá từ 1,2 tỷ, lãi suất 6% cố định trong 10 năm, 0972899510","KĐT Trung Văn, Quận Nam Từ Liêm, Hà Nội",72,1.6,3,2,37,Đông nam,60,,2,3932866
Chỉ cần 460 triệu sở hữu ngay căn hộ view sông tại tt thành phố,"D – Aqua, Quận 8, TP HCM",69,3,2,2,25,,20,20,,3881043
Thanh toán 50 triệu - sở hữu ngay căn hộ cao cấp d- homme liên hệ: 0909.229.806,"D-Homme, Quận 6, TP HCM",69,4.4,2,2,30,,30,,,3932846
Giảm giá căn hộ lavita thuận an hưng thịnh 2.5 tỷ còn 1.65 tỷ 75m2 2 phòng ngủ,"Thị Xã Thuận An, Bình Dương",75,1.88,2,2,,,,,,3939116
Căn hộ lavita thuận an ck khủng lên đến 700tr/căn chỉ trong t7. lh: 0931337588,"Thành phố mới Bình Dương , Bình Dương",70,1.75,2,2,,,,,,3937777
"Chung cư hót nhất, duy nhất năm 2021 tại thanh xuân - quà tân gia 100 triệu","Housinco Premium, Huyện Thanh Trì, Hà Nội",75,Thỏa thuận,2,2,,,,,1,3942389
"Quỹ căn đợt 1 cđt - housinco nguyễn xiển , chỉ từ 2 tỷ/ 2 ngủ","Quận Thanh Xuân, Hà Nội",94,3,3,2,,,,,1,3930699
"Chính chủ bán căn hộ chung cư a3 2 phòng ngủ 2 wc 1,3 tỷ. bao sang tên","Chung cư EuroLand Làng Việt Kiều, Quận Hà Đông, Hà Nội",64,1.3,2,2,,Đông,,,,3942628
"Chỉ 135 triệu sở hữu căn hộ cao cấp legacy central, giấc mơ an cư lý tưởng","Legacy Central, Thị Xã Thuận An, Bình Dương",35,0.135,1,1,15,Đông nam,32,,,3942618
"Feliz homes tâm điển phía nam hà nội, dự án duy nhất có quần thể không gian xanh","Feliz Homes, Quận Hoàng Mai, Hà Nội",96,3.2,3,2,,,,,3,3942076
"Căn hộ biển sở hữu tổ hợp giải trí: thỏi nam châm thu hút nhà đầu tư""","Takashi Ocean Suite, Thành Phố Quy Nhơn, Bình Định",45,1.39,1,1,39,Đông nam,,,,3942611
Bán chung cư handico a1 đường 32 giá gốc chủ đầu tư,"Thành phố Vinh, Nghệ An",852,Thỏa thuận,,,,,,,,3934712
Chung cư cửa tiền vào ở ngay chỉ hơn 600tr,"Thành phố Vinh, Nghệ An",60,Thỏa thuận,,,,,,,,3933946
Ecocity việt hưng . bán căn 72m2 ban công đông nam . nhận nhà ở ngay . đã có sổ,"Căn hộ Eco City Việt Hưng, Quận Long Biên, Hà Nội",72,2,2,2,7,Đông nam,,,1,3876716
"Chung cư tsg lotus sài đồng chỉ 25,6 tr/m2 , hỗ trợ vay 70%","TSG Sài Đồng Lotus, Quận Long Biên, Hà Nội",86,2.2,3,2,11,Đông nam,,,,3895507
"Ecocity việt hưng . chỉ 600tr nhận nhà ở ngay , vay 0% 2 năm , ân hạn nợ gốc","KĐT Việt Hưng, Quận Long Biên, Hà Nội",64,1.8,2,2,,Đông nam,,,,3874589
Mua căn hộ view vịnh hạ long chỉ với 620 triệu,"Thành Phố Hạ Long, Quảng Ninh",30,0.62,,,,,,,,3942599
Chiết khấu ngay 25 ptrăm khi thanh toán 95 ptrăm căn hộ cao cấp lavita thuận an,"Nguyễn Thị Minh Khai, Thị Xã Thuận An, Bình Dương",90,2.5,3,2,,,,,,3935700
"Rổ hàng 100 căn hộ charm city giá tốt nhất, chỉ thanh toán 15%","ĐT - 743, Thị Xã Dĩ An, Bình Dương",93.48,2.7,3,2,27,Đông nam,,,,3942595
"Chỉ 900tr có ngay căn 3pn nhận nhà ở ngay, tặng 2 năm phí dv tại hpc landmark","Tố Hữu, Quận Hà Đông, Hà Nội",135,3,4,3,15,Đông bắc,,,2,3942594
🥰căn 3 ngủ🥰tầng vip🥰căn góc🥰view bể bơi🥰cc green pearl bắc ninh🥰lh 0833582,"Green Pearl Bắc Ninh, TP. Bắc Ninh, Bắc Ninh",95,2.6,3,2,29,Đông nam,,,,3942589
Căn hộ cao cấp Opal City View trung tâm thành phố Thủ Dầu một,"Phường Phú Thọ, Thành phố Thủ Dầu Một, ",45,Thỏa thuận,,,,,,,,3942467
Căn hộ 1pn dự án picity high park quận 12,"Picity High Park, Quận 12, TP HCM",48,2.1,1,1,,,25,,,3941857
"Mua nhà mùa dịch, hãy chọn picity high park quận 12","Picity High Park, Quận 12, TP HCM",57,2.5,,,,,25,,,3942043
"Căn hộ 3 pn cao cấp rẽ nhất sài gòn, sổ hồng lâu dài","Picity High Park, Quận 12, TP HCM",79,3.2,3,2,18,,25,,,3941277
BÁN CĂN HỘ CHUNG CƯ CAO CẤP - PARKVIEW CITY DABACO HUYỀN QUANG VÀO TÊN CHO NGƯỜI NƯỚC NGOÀI ,"Huyền Quang, TP. Bắc Ninh, ",72,Thỏa thuận,2,2,,Tây Bắc,,,,3942583
Căn hộ rẻ nhất vịnh bắc bộ. chiết khấu khủng,"Quận Hà Đông, Hà Nội",136,3,3,3,26,,,,,3942573
Ch cao cấp 3pn 97m2 kđt sài đồng giá 3 tỷ 3x - free 1 năm phí dv,"Quận Long Biên, Hà Nội",97,3.1,3,2,,,,,,3926899
Căn hộ 63m2 tòa l3 dự án le grand jardin htls 0% 12 tháng ck 3%,"Quận Long Biên, Hà Nội",63,2.1,2,2,,,,,,3926902
"Bán căn hộ eco city sổ đỏ trao tay ở ngay trong hỗ trợ vay 70%, full nội thất","Quận Long Biên, Hà Nội",63,1.8,2,2,,,,,,3926887
"Eco city việt hưng: chỉ 600tr nhận nhà ở ngay, vay 0% ls 2 năm, tặng 2 chỉ vàng","Quận Long Biên, Hà Nội",65,1.8,2,2,,,,,,3926889
"Chỉ 2,4 tỷ nhận nhà ở ngay căn góc 3 pn 86m2 eco city việt hưng, đã có sổ, ls0%","Quận Long Biên, Hà Nội",63,1.8,2,2,,,,,,3926893
"Căn hộ honas residence mt mỹ phước tân vạn, giá 26tr/m2","Bình Thung, Thị Xã Dĩ An, Bình Dương",43,1.1,1,1,,Đông nam,,,1,3922251
"Bán căn hộ 3pn view sông masteri thảo điền, 92m2, đầy đủ nội thất, lầu 20","Căn hộ Masteri Thảo Điền, Quận 2, TP HCM",93,5.98,3,2,,,,,,3922257
"Bán căn hộ 3pn view sông masteri thảo điền, 92m2, đầy đủ nội thất, lầu 20","Căn hộ Masteri Thảo Điền, Quận 2, TP HCM",93,5.98,3,2,,,,,,3922257
"Bán căn hộ 3pn tại khu đô thị văn khê, hà đông, thanh toán 320tr nhận nhà ở ngay","Văn Khê, Quận Hà Đông, Hà Nội",143,3.1,3,3,15,,,,4,3942530
"Bán căn hộ cao cấp nera garden huế đường tố hữu, tp. huế, giá cực tốt","Thành Phố Huế, Huế",61,1.85,,,,,,,,3942529
SỞ hỮu nhÀ sang - quÀ vÀng nhƯ Ý tẠi le grand jardin - kh,"Sai Dong, Long Bien, Ha Noi",65,0.31,1,1,1,---,1,12,,3942526
Bán căn hộ cao cấp the view-riviera point liền kề phú mỹ hưng 3pn-2wc,"Riviera Point, Quận 7, TP HCM",125,6.7,3,2,20,Đông,,,1,3942522
Bán gấp căn penthouse 320m2 riviera point quận 7. dt 320m2 giá 18 tỷ. 0919508828,"Riviera Point, Quận 7, TP HCM",320,18,5,5,39,Đông nam,10,10,,3911088
Bán gấp căn penthouse 320m2 riviera point quận 7. dt 320m2 giá 20 tỷ.,"Quận 7, TP HCM",320,20,4,3,38,,10,10,1,3837152
Chương trình t7 căn hộ lavita thuận an ck khủng lên đến 700tr/căn. lh:0931337588,"Thành phố mới Bình Dương , Bình Dương",73,1.75,2,2,,,,,,3938713
"Bán căn hộ legacy central 900tr/căn, thanh toán 225 triệu nhận nhà","Legacy Central, Thị Xã Thuận An, Bình Dương",32,0.9,,,,,,,,3942507
"Chỉ 3.2 tỷ, tt 500tr sở hữu ngay ch 3pn 3bc hướng đông nam le grand jardin","Chung cư Le Grand Jardin, Quận Long Biên, Hà Nội",97,3.2,3,2,,Đông nam,,,,3941468
Bán căn hộ view sông giá chỉ từ 400 triệu.,"Quy Nhon, B\u00ECnh \u0110\u1ECBnh",60,1.3,2,2,7,---,35,7,,3942496
Bán căn hộ imperia smart city - chỉ hơn 1 tỷ - chiết khấu tới 9.5% gtch,"Vinhomes Smart City, Quận Nam Từ Liêm, Hà Nội",30,1,1,1,,Tây Nam,,,,3942488
Chung cư eurowindow - nhận nhà ở ngay - vay vốn 0%,"Eurowindow Garden City, Thành phố Thanh Hóa, Thanh Hóa",55,1,2,1,20,Đông nam,20,5,,3942482
Ưu đãi chiết khấu và chính sách hấp dẫn mùa dịch chỉ có tại legacy central,"Legacy Central, Thị Xã Thuận An, Bình Dương",33,0.135,1,1,16,Đông nam,,,,3942480
Chiết khấu mùa covid hỗ trợ lên đến 24.5%* kh đã sở hữu căn hộ cao cấp,"Grand Center, Thành Phố Quy Nhơn, Bình Định",50,1.65,1,1,43,Tây bắc,50,,1,3942479
Chiết khấu mùa covid hỗ trợ lên đến 24.5%* kh đã sở hữu căn hộ cao cấp,"Grand Center, Thành Phố Quy Nhơn, Bình Định",50,1.65,1,1,43,Tây bắc,50,,1,3942479
"Feliz homes tận hưởng 365 ngày thanh khiết cùng ion âm, tâm điểm phía nam hà nội","Feliz Homes, Quận Hoàng Mai, Hà Nội",96,3.2,3,2,,Đông nam,,,3,3942472
"Rose town - 79 ngọc hồi tâm điểm phía nam hà nội, mở bán thêm nhiều quỹ căn mới","Rose Town, Quận Hoàng Mai, Hà Nội",65,1.8,2,2,,,,,2,3942471
Chính chủ bán gấp ch cao cấp giá tốt nhất quận 7,"Căn hộ Eco Green Sài Gòn, Quận 7, TP HCM",80,4.5,3,2,9,,50,50,,3891223
Sở hữu nhà tại thành phố hcm chỉ từ 660 triệu full nội thất 2pn tiện ích p.phú,"West Gate Park, Huyện Bình Chánh, TP HCM",59,2.18,,,,,,,,3942460
"Cần bán căn hộ 2 pn siên tích 76m2 giá từ 2,5 tỷ tại quận hoàng mai","Feliz Homes, Quận Hoàng Mai, Hà Nội",76,2.54,2,2,27,Tây bắc,,,1,3942457
Cập nhật thông tin dự án feliz homes mới nhất với nhiều chính sách mới nhất,"Feliz Homes, Quận Hoàng Mai, Hà Nội",107,3.52,3,2,27,Đông nam,,,1,3942452
Cần bán nhanh căn góc 3 phòng ngủ giá 3.56 tỷ mặt đường nguyễn xiển,"Housinco Premium, Huyện Thanh Trì, Hà Nội",94,3.56,3,2,31,Đông nam,,,1,3942450
680tr căn hộ cc housinco - 288 nguyễn xiển. trả góp ls 0%. 12 tháng. 0975762669,"Housinco Premium, Huyện Thanh Trì, Hà Nội",62,0.1364,2,2,31,Đông nam,30,20,1,3937713
"Nhận nhà ở ngay, 1 năm ko lo mất lãi. 1,8 tỉ - 65m2 - 2pn. trung tâm hoàng mai","Rose Town, Quận Hoàng Mai, Hà Nội",65,1.8,2,2,20,,,,,3939120
Căn 65m2. 2pn - trả trước 570tr . kí hđmb trực tiếp vs cđt. ls 0% 12 tháng.,"Rose Town, Quận Hoàng Mai, Hà Nội",65,1.8,2,2,20,Đông bắc,,,,3939355
Bán chung cư trả góp 0% - q.hoàng mai giải phóng. cách bx nước ngầm 800m.,"Quận Hoàng Mai, Hà Nội",65,1.91,2,2,,Đông nam,,,,3939522
"Hưng thịnh gây sốc biên hòa universe - giảm mạnh 1 tỷ, căn 2,4 tỷ còn 1,4 tỷ","Biên Hòa Universe Complex, TP Biên Hòa, Đồng Nai",72,1.4,2,2,24,Đông nam,,,,3942441
"Bán hộ 3pn, 96m2 giá tốt nhất dự án feliz homes, hướng mát vay ls 0% 18 tháng","Feliz Homes, Quận Hoàng Mai, Hà Nội",96,3,3,2,15,,,,,3942436
"Duy nhất t8 này, căn hộ resort lavita thuận an chỉ 1,5 tỷ/ căn 70m2. ckhấu 18%","Xã Thuận Giao, Thị Xã Thuận An, Bình Dương",70,1.5,2,2,30,Đông nam,100,,,3942426
"Moonlight centre point chỉ 2,7 tỷ/ 2pn. góp 1%/tháng. c/khấu 18%","TÊN LỬA, Quận Bình Tân, TP HCM",66,2.7,2,2,24,Đông nam,100,,,3942409
Vững tâm kinh doanh tại sun marina town hạ long,"Thành Phố Hạ Long, Quảng Ninh",50,2.8,,,,,,,,3942405
Chuyển công tác gđ tôi cần bán căn hộ chung cư vinhomes gardenia 2pn,"Vinhomes Gardenia Mỹ Đình, Quận Nam Từ Liêm, Hà Nội",86,3.6,2,2,,Tây Nam,,,1,3942402
Căn 3pn duy nhất tại dự án grand center quy nhơn,"Grand Center, Thành Phố Quy Nhơn, Bình Định",90,2.9,3,2,6,Đông bắc,32,32,4,3942398
"Chung cư giá tốt nhất giải phóng hoàng mai, trả góp lãi 0%, quần thể","Phương Đông Green Park, Quận Hoàng Mai, Hà Nội",75,1.76,,,,,,,,3939742
"1.5 tỷ/căn 2 ngủ chung cư vip ngay định công, trả góp lãi 0%","Định Công, Quận Hoàng Mai, Hà Nội",60,1.5,,,,,,,,3930015
Sở hữu căn hộ với hơn 50 tiện ích vượt trội tại bình chánh với chỉ 310 triệu,"Huyện Bình Chánh, TP HCM",60,2,2,2,,,,,,3942390
Bán chung cư mini cầu giấy 600tr/căn 30-46m2 vào ở ngay,"Quận Cầu Giấy, Hà Nội",35,0.6,1,1,,,,,,3612633
Chung cư Iris Garden view Sân vận động Mỹ Đình,"Chung cư IRis Garden, Quận Nam Từ Liêm,",60.9,2.5,,,,Nam,,,,3942371
Còn duy nhất căn 2pn giá tốt nhất dự án feliz homes đền lừ - chiết khấu sâu,"Feliz Homes, Quận Hoàng Mai, Hà Nội",76,2.5,2,2,,Tây bắc,,,,3942341
"Mở bán căn hộ chỉ 2.2 tỷ căn 2pn, vay ls 0% trong 12 tháng","Tân Triều, Huyện Thanh Trì, Hà Nội",62,2.3,2,1,,Đông nam,,,,3942338
Housinco premium dự án bàn giao full nội thất ngay tại ngã tư khuất duy tiến,"Housinco Premium, Huyện Thanh Trì, Hà Nội",93,3.3,3,2,,Đông nam,,,3,3942337
Kđt rose town chỉ cần 540 triệu là có thể sở hữu ngay căn hộ tại tt q.hoàng mai,"Rose Town, Quận Hoàng Mai, Hà Nội",92,2.5,3,2,,Đông nam,,,3,3942332
"Căn góc 3 pn hướng đông nam tầng cao view trọn vinhomes chỉ 2,2 tỷ lh 0909860283","Căn hộ Eco City Việt Hưng, Quận Long Biên, Hà Nội",83,Thỏa thuận,2,2,7,Đông nam,,,1,3921172
"Siêu phẩm lavender garden, chỉ từ 1,7 tỷ nhận ngay căn hộ tại định công","Quận Thanh Xuân, Hà Nội",51,1.7,,,9,,,,,3942314
Udic westlake mua trực tiếp giá cđt- hỗ trợ lãi suất 0% lên tới 36 tháng,"Võ Chí Công, Quận Tây Hồ, Hà Nội",116,4.41,3,2,17,Tây Nam,,,1,3942311
"Căn góc duy nhất 143m2, giá tốt nhất dự án thanh toán tiến độ không phải trả lãi","HPC Landmark Tower, Quận Hà Đông, Hà Nội",135,3,4,3,15,Đông bắc,,,2,3942298
Bán nhà thuận an trả trước 135 triệu ngân hàng hô trợ 70% 2 năm không lãi suất,"Thị Xã Thuận An, Bình Dương",33,0.135,1,1,16,Đông bắc,32,,,3942296
Chiết khấu cao và chính sách hấp dẫn mùa dịch chỉ có ở legacy central,"Thị Xã Thuận An, Bình Dương",33,0.135,1,1,15,Đông nam,32,,,3942283
Cần bán căn 1pn 2 mặt tiền sun marina town,"Sun Grand Marina Town, Thành Phố Hạ Long, Quảng Ninh",48,4.39,,,27,Tây bắc,,,,3942273
Feliz homes căn hộ giữa tt q. hoàng mai mở bán quỹ căn mới & chính sách ưu đãi,"Feliz Homes, Quận Hoàng Mai, Hà Nội",96,0.3072,3,2,,Đông nam,,,3,3942266
Căn hộ lagecy central thuận an giá chỉ từ 900 triệu,"Legacy Central, Thị Xã Thuận An, Bình Dương",60,0.9,2,2,29,,12,12,,3942267
"Tổ ấm cho các gia đình trẻ tại trung tâm hoàng mai giá từ 2,77 tỷ","Feliz Homes, Quận Hoàng Mai, Hà Nội",77,2.78,2,2,27,Tây Nam,,,1,3942257
An cư lập nghiệp .tại feliz homes sẽ giúp bạn một nơi an cư đáng sống,"Feliz Homes, Quận Hoàng Mai, Hà Nội",96,3.22,3,2,27,Đông bắc,,,1,3942256
"Căn hộ an gia, nhiều ưu đãi quà tặng đến ~5% giá trị căn hộ","West Gate Park, Huyện Bình Chánh, TP HCM",59,2.1,2,2,,,,,1,3942253
Chào tháng ngâu quà siêu ngầu tại housinco thanh trì,"Housinco Premium, Huyện Thanh Trì, Hà Nội",94,3.56,3,2,31,Đông nam,,,1,3942238
"Suất ngoại giao 2pn - 3pn tòa dv04 rose town, giá rẻ nhất, trực tiếp cđt","Rose Town, Quận Hoàng Mai, Hà Nội",71,1.9,2,2,,,,,,3942244
Căn hộ view biển sở hữu lâu dài - giai điệu nhật bên vịnh thiên đường,"Takashi Ocean Suite, Thành Phố Quy Nhơn, Bình Định",45,1.39,1,1,,,80,,,3942216
"Sun marina town xu hướng sở hữu ""nhà hiệu"" mới của giới siêu giàu","Thành Phố Hạ Long, Quảng Ninh",50,2.7,,,,,,,,3942212
Đang mùa dịch có chương trình hấp dẫn cho khách nhiều phần hưu đãi,"Quy Nhơn Melody Hưng Thịnh, Thành Phố Quy Nhơn, Bình Định",70,2.1,2,2,35,Đông bắc,30,25,3,3942210
Cđt bán ccmn hào nam 600tr/căn 35-50m2 full nội thất cao cấp,"Quận Đống Đa, Hà Nội",35,0.6,1,1,8,Đông,,,,3345613
"Bán căn hộ ở liền tháng 10, 1.3 tỷ căn 52m2, hỗ trợ nh 70%","Quận 12, TP HCM",52,1.3,2,1,24,,30,30,,3935416
"Bán căn hộ vista thuận an, nhận nhà trước tết hỗ trợ nh 70%","Quận 12, TP HCM",48,1.2,2,1,24,,,30,,3941148
Thỏa ước mơ sở hữu nhà chỉ với #200 triệu tại legacy central,"Thành phố Thủ Dầu Một, Bình Dương",33,0.9,1,1,29,,16,16,,3939568
"Căn hộ dưới 1 tỷ, hỗ trợ ân hạn gốc lãi tới nhận nhà, pháp lý 100%","Quận 12, TP HCM",33,0.9,1,1,29,,,20,,3939002
Chung cư ia20 ciputra giá 18.5tr/m2 chenh 40tr,"Đường Đông Ngạc, Quận Bắc Từ Liêm,",107,1.98,,,,Đông nam,,,,2736106
Bán căn 02 ngủ imperia smart city giá cực kỳ ưu đãi,"Vinhomes Smart City, Quận Nam Từ Liêm, Hà Nội",76,1.9,2,,,Đông nam,,,,3941660
Chỉ 600tr sở hữu ngay căn hộ 02 ngủ tại trung tâm quận hà đông,"Chung cư BID Residence, Quận Hà Đông, Hà Nội",68,1.89,2,2,,,,,1,3941950
