title,address,area,price,number_bedroom,number_wc,number_floor,direction,entrance,facade,number_parking,id_estate
The aston nhatrang khánh hoà kề sông cận biển,"The Aston Luxury Residence, Phường Xương Huân, Thành Phố Nha Trang, Khánh Hòa",80,56,2,2,27,Đông nam,200,100,2,3945932
Chỉ 2.7 tỉ sở hữu căn hộ 3 phòng ngủ miễn lãi suất vay nh tới 12 tháng,"Chung cư Le Grand Jardin, Quận Long Biên, Hà Nội",83,2.7,3,2,15,Đông bắc,40,,,3923967
Vén màn tầm view trục căn thấp tầng à la carte halong bay - vịnh hạ long chưa ba,"À La Carte Halong Bay, Phường Hùng Thắng, Thành Phố Hạ Long, Quảng Ninh",56,2,2,2,41,,,,,3945903
Chỉ từ 450tr sở hữu ngay căn hộ cao cấp the lines tại đại đô thị triệu cây xanh,"KĐT Ecopark, Xã Cửu Cao, Huyện Văn Giang, Hưng Yên",84,0.3108,3,2,,Đông nam,,,,3945883
Chính chủ bán chung cư n09b2 tại kđt dịch vọng- cầu giấy,"KĐT Dịch Vọng, Phường Dịch Vọng, Quận Cầu Giấy, Hà Nội",133.2,5.33,3,2,,,,,,3945574
Căn hộ cao cấp paris thủ thiêm quận 2 giá bán chỉ 1 5 tỷ căn 2 phòng ngủ,"Paris Hoàng Kim, Phường Bình Khánh, Quận 2, TP HCM",73,1.5,2,2,26,,,,,3945868
Booking 50tr/căn có hoàn lại căn hộ cao cấp view sông sài gòn,"BẾN NGHÉ, Phường Tân Thuận Đông, Quận 7, TP HCM",63,0.065,1,1,18,,10,30,,3945854
Bán gấp căn hộ chung cư tecco bình minh - thanh hóa,"Chung cư Tecco Thanh Hóa, Phường Đông Hương, Thành phố Thanh Hóa, Thanh Hóa",57,1.1,2,2,,Đông nam,,,,3945848
Bán căn hộ udic westlake view đường võ chí công hướng đông nam siêu đẹp,"Udic Westlake, Phường Phú Thượng, Quận Tây Hồ, Hà Nội",147,6,4,3,,Đông nam,40,,2,3945833
"Sở hữu căn 2pn view sông, mt eastmark, thanh toán trước chỉ 20%","MT Eastmark City, Phường Long Trường, Quận 9, TP HCM",70,2.52,2,2,,,,,,3945808
Bán ngay căn hộ 2 phòng ngủ trung tâm tp bắc ninh,"Green Pearl Bắc Ninh, Phường Võ Cường, TP. Bắc Ninh, Bắc Ninh",79,1.7,2,2,10,Đông nam,,5,1,3945798
Cần bán căn hộ stown tham lương 3pn quận 12,"Phường Tân Thới Nhất, Quận 12, TP HCM",87,2.25,3,2,,Đông nam,,15,,3945800
Booking căn hộ cao cấp the lines nằm trong đại đô thị triệu cây xanh,"KĐT Ecopark, Xã Cửu Cao, Huyện Văn Giang, Hưng Yên",56,2.52,2,1,15,Đông nam,,,1,3945755
160tr sở hữu ngay căn hộ cao cấp tại trung tâm tp thuận an.,"Legacy Central, Phường Thuận Giao, Thị Xã Thuận An, Bình Dương",42,0.9,1,1,,,,,4,3945750
Bán căn hộ nội thất cao cấp Diamond connect,"Quốc lộ 1K, Thị Xã Dĩ An,",60,1700,,,,,,,,3945735
Bán suất ngoại giao tòa tháp thiên niên kỷ - số 4 quang trung - hà đông.,"Quang Trung, Quận Hà Đông, Hà Nội",75,2.4,2,2,44,Đông nam,40,70,3,3815520
Căn hộ cc phú thịnh green park chỉ 26tr/m2 giữa tt hành chính quận hà đông,"Phú Thịnh Green Park, Quận Hà Đông, Hà Nội",83,2,3,2,36,Đông bắc,30,30,,3903544
Căn hộ khoáng nóng view sông sài gòn - mở bán giai đoạn 1,"BẾN NGHÉ, Phường Tân Thuận Đông, Quận 7, TP HCM",80,0.065,2,2,18,,10,30,,3945586
"Chỉ từ 1,8 tỉ nhận nhà ở ngay căn hộ 68m2, view sông đuống chân cầu đông trù","Chung cư Eurowindow River Park, Xã Đông Hội, Huyện Đông Anh, Hà Nội",68.6,1.8,2,2,,,,,,3945568
Bán tổng hợp quỹ căn vinhomes smart city,"Vinhomes Smart City, Phường Đại Mỗ, Quận Nam Từ Liêm, Hà Nội",54.6,2.3,2,1,,,,,,3945566
"Mở bán quỹ căn 2pn, 3pn đẹp nhất dự án heritage westlake, view ôm trọn hồ tây","Phường Bưởi, Quận Tây Hồ, Hà Nội",145,14,,,,Đông nam,,,,3945515
"Đừng bỏ lỡ cơ hội sở hữu chcc bậc nhất lbiên với giá chỉ 2.9tỷ/2pn, 3,9tỷ/3pn","Berriver Jardin, Phường Bồ Đề, Quận Long Biên, Hà Nội",75,3.38,2,2,,,,,,3945493
Căn hộ duplex udic westlake võ chí công giá sốc chỉ 32tr/m2,"Udic Westlake, Phường Phú Thượng, Quận Tây Hồ, Hà Nội",249,7.97,5,4,2,Đông nam,,,,3945474
Căn hộ legacy trung tâm thuận an- tt 15% nh cho vay 20 năm,"Legacy Central, Phường Thuận Giao, Thị Xã Thuận An, Bình Dương",45,1.28,2,1,,Tây bắc,,,4,3945414
"Căn hộ vista riverside view sông sài gòn, tặng nội thất - bàn giao hoàn thiện.","Căn hộ Vista Riverside, Thị Xã Thuận An, Bình Dương",39,1.08,1,1,,,,,,3944211
Bán căn studio view hồ imperia smart city tây mỗ,"Phường Cầu Diễn, Quận Nam Từ Liêm, Hà Nội",31,1.16,1,1,,,,,,3945375
Bán căn studio view hồ imperia smart city,"Vinhomes Smart City, Phường Tây Mỗ, Quận Nam Từ Liêm, Hà Nội",31,1.16,1,1,,Đông bắc,,,,3945372
Cần bán căn 3 ngủ heritage west lake vew hồ tây full nội thất cao cấp giá 13 tỷ.,"Lạc Long Quân, Phường Phú Thượng, Quận Tây Hồ, Hà Nội",145,13,3,2,,Đông nam,,,2,3945333
Bán căn hộ thủ dầu một - bình dương giá 1.85 tỷ,"Phường Phú Hòa, Thành phố Thủ Dầu Một, Bình Dương",50,1.8,3,2,40,,,,2,3945324
Bán căn 2pn 62 4m đến 79m tecco diamond giá 1 8 tỉ đến 2 4 tỉ,"Tứ Hiệp, Xã Tứ Hiệp, Huyện Thanh Trì, Hà Nội",64,1,2,2,25,Đông nam,12,7500,,3945269
Cần bán chung cư 1050 chu văn an bình thạnh,"CHU VĂN AN, Phường 12, Quận Bình Thạnh, TP HCM",60,2650,2,1,,,,,,3945266
Chính chủ bán căn góc chung cư i-home gò vấp 2.2 tỷ,"I-Home, Phường 14, Quận Gò Vấp, TP HCM",68,2.2,2,2,7,Nam,,20,,3945244
"Happy one bình dương, căn hộ tốt nhất trung tâm tp. thủ dầu một, cho thuê lên đế","Phường Phú Hòa, Thành phố Thủ Dầu Một, Bình Dương",50,1.8,3,2,20,,,,3,3945209
Căn hộ đẳng cấp chỉ với từ 1 tỷ 390 triệu,"Takashi Ocean Suite, Thành Phố Quy Nhơn, Bình Định",40,1.39,1,1,,,,,,3943724
"Quỹ căn đợt cuối hc golden city chỉ từ 3.55 tỷ/căn 3pn, quà tới 100tr ck 4%","HC Golden City, Phường Bồ Đề, Quận Long Biên, Hà Nội",82.1,3.55,3,2,25,Tây Nam,40,,1,3945180
Căn hộ chung cư the lines giữa đại đô thị cây xanh ecopark,"KĐT Ecopark, Xã Cửu Cao, Huyện Văn Giang, Hưng Yên",84,4,3,2,10,Đông nam,,,,3945121
Bán căn hộ chung cư cao cấp t t vitoria trung tâm tp vinh,"Phường Quang Trung, Thành phố Vinh, Nghệ An",55,1.49,2,2,28,,12,,4,3945115
Cần bán căn 4 ngủ heritage west lake vew hồ tây full nội thất cao cấp giá 18 t,"Phú Thượng, Phường Phú Thượng, Quận Tây Hồ, Hà Nội",181,18,,,,Đông nam,,,,3945110
Căn hộ biển nha trang chỉ 27tr/m2 sở hữu lâu dàii,"Khu đô thị biển An Viên, Phường Vĩnh Trường, Thành Phố Nha Trang, Khánh Hòa",70,2.92,2,2,4,Đông nam,,,2,3945111
"Bán ngay căn 2pn (71m2) tầng 5, bc đông bắc, chỉ 2.2 tỷ tại phương đông green","KĐT Việt Hưng, Phường Đức Giang, Quận Long Biên, Hà Nội",71,2.2,2,2,5,,,,,3945102
Bán căn hộ nội thất cao cấp diamond connect gần go dĩ an,"Quốc lộ 1K, Phường Đông Hòa, Thị Xã Dĩ An, Bình Dương",53.3,0.66,1,1,3,Bắc,30,30,,3945098
"Chỉ với 1,779 tỷ sở hữu ngay căn hộ trung tâm quận thanh trì","Tecco Diamond, Xã Tứ Hiệp, Huyện Thanh Trì, Hà Nội",64,1.78,2,2,,Đông nam,,,1,3945090
Cần bán căn hộ 81m2 chung cư everrich infinity quận 5,"Căn hộ Everrich Infinity, Phường 1, Quận 5, TP HCM",81,6.6,2,2,25,Đông bắc,,,,3945084
"Bán ch penthouse the link 345 6pn/260m2 13,5tỷ view cực đẹp","Phường Đông Ngạc, Phường Đông Ngạc, Quận Bắc Từ Liêm, Hà Nội",260,13,6,4,,Đông bắc,,,,3945061
"Bán căn hộ mt phạm văn đồng nối dài ,ngay làng đại hoc thủ đức","Phường Bình Chiểu, Quận Thủ Đức, TP HCM",65,0.66,2,2,,,30,54,4,3945057
Căn hộ chung cư cao cấp hiếm hoi tại thuận an 160tr nhận nhà,"Lê Lợi, Phường Hòa Phú, Thành phố Thủ Dầu Một, Bình Dương",59,1.1,2,2,,,10,,1,3945017
Sở hữu căn hộ cao cấp chỉ 160tr tại tt tp thuận an,"Legacy Central, Phường Thuận Giao, Thị Xã Thuận An, Bình Dương",42,0.9,1,1,,,,,,3945010
"Căn hộ him lam chợ lớn, sổ hồng, 2pn-2wc, giá từ 3.2 tỷ","Dự án Him Lam Chợ Lớn, Quận 6, TP HCM",86,3.18,2,2,,Đông nam,,,,3873314
"Ch him lam phú đông, 65m2 2pn-2wc giá 2.250tỷ (đã có sổ hồng). hỗ trợ vay nh","Thị Xã Dĩ An, Bình Dương",65,2.25,2,2,,Tây bắc,,,1,3807529
Bán căn hộ him lam phú an nhà cực mới nội thất cao cấp cho vay 70%,"Quận 9, TP HCM",69,2.5,2,2,,Đông nam,,,2,3742885
"Bán căn hộ him lam chợ lớn 102m2, full nội thất như hình","Dự án Him Lam Chợ Lớn, Quận 6, TP HCM",102,3.49,2,2,14,Tây Nam,,,,3638097
"Cần bán b3-1x-07, 97m2 him lam chợ lớn, giá 3,55 tỷ full nội thất","Dự án Him Lam Chợ Lớn, Quận 6, TP HCM",97,3.55,2,2,16,Tây Nam,,,,3873311
"Căn hộ eco xuân bình dương, cđt setia malaysia, giá 26 triệu/m2","Eco Xuân Sky Residences, Thị Xã Thuận An, Bình Dương",86,0.1978,3,2,,Đông,,,,3873331
"Cần bán căn hộ him lam chợ lớn block b và c, giá 2021, lh tài 0967.087.089","Dự án Him Lam Chợ Lớn, Quận 6, TP HCM",86,3.2,2,2,,Đông nam,,,1,3890812
Bán căn hộ khu c topaz đường bờ bao tân thắng q tân phú,"Phường Sơn Kỳ, Quận Tân Phú, TP HCM",69,2.6,2,1,7,,15,15,,3944830
Chính chủ bán căn hộ cc thanh yến đường thanh đa p27 bình thạnh,"Phường 27, Quận Bình Thạnh, TP HCM",70,3.45,2,2,,Đông nam,15,15,,3944824
Chính chủ bán gấp giá tốt căn hộ 49m2 cc vision bình tân,"Phường Tân Tạo A, Quận Bình Tân, TP HCM",49,1.5,1,1,,,15,15,,3944818
Bán căn hộ 133m2 chung cứ sme hoàng gia hà đông,"Chung cư SME Hoàng Gia, Phường Quang Trung, Quận Hà Đông, Hà Nội",133,Thỏa thuận,3,3,6,Đông nam,,,,3944806
Căn hộ khoáng nóng tại tp.hcm - quản lý và vận hành taisei & tribe nhật bản,"BẾN NGHÉ, Phường Tân Thuận Đông, Quận 7, TP HCM",88,5.5,2,2,18,,10,30,,3944670
Cần bán căn hộ topaz twins p. thống nhất biên hòa giá 2.55 tỷ bao sang tên,"Phường Thống Nhất, TP Biên Hòa, Đồng Nai",77,2.55,2,2,,,,,,3944661
Cần bán căn hộ 62m2 topaz twins p. thống nhất biên hòa giá 1.95 tỷ,"Phường An Bình, TP Biên Hòa, Đồng Nai",62,1.95,1,1,,,,,,3944654
"Bán nhanh căn hộ tầng 11, căn 2 pn, dt 57m2- chung cư ori garden đà nẵng","KĐT Lakeside Palace, Phường Hòa Hiệp Nam, Quận Liên Chiểu, Đà Nẵng",56.6,1.25,,,,Đông nam,,,,3944631
Kẹt tiền tôi cần bán căn hộ 62m2 topaz twins p.thống nhất biên hòa full nội thất,"Phường Thống Nhất, TP Biên Hòa, Đồng Nai",62,2.1,1,1,,,,,,3944625
Chính chủ cần bán gấp căn hộ 105m2 giá 4.3 tỷ bao phí tại king palace,"Nguyễn Trãi, Phường Thượng Đình, Quận Thanh Xuân, Hà Nội",105,4.3,3,2,,,,,1,3944621
Cần bán gấp căn hộ 100m2 giá 4 ỷ tại chung cư handi resco 31 lê văn lương,"Chung cư Handiresco Lê Văn Lương, Phường Nhân Chính, Quận Thanh Xuân, Hà Nội",100,4,3,2,,,,,1,3944615
Cần bán gấp căn hộ 128m2 giá 5 tỷ tại times tower,"Chung cư HACC1 Complex Tower, Phường Hạ Đình, Quận Thanh Xuân, Hà Nội",128,5,3,2,,,,,1,3944605
T&t vitoria -căn hộ chung cư số 1 tp vinh thanh toán 500 triệu sở hữu căn hộ vị,"Phường Quang Trung, Thành phố Vinh, Nghệ An",58,Thỏa thuận,2,2,28,,,,,3944590
"Bán căn góc 2 pn chung cư ori garden đà nẵng chỉ 1,5 tỷ bao thuế","KĐT Lakeside Palace, Phường Hòa Hiệp Nam, Quận Liên Chiểu, Đà Nẵng",56.7,1.5,2,2,,,,,,3944587
"Bán căn hộ topaz twins p. thống nhất biên hòa giá 1.81 tỷ/ căn, hỗ trợ vay nh","TP Biên Hòa, Đồng Nai",62,1.81,1,1,,,,,,3908638
Chuyển nhượng căn hộ chung cư 140m2 tại no4b-t1 ngoại giao đoàn,"Quận Tây Hồ, Hà Nội",140,4.05,3,2,26,Đông nam,,,1,3944145
"Chỉ với 1.7 tỷ sở hữu căn hộ the sailing ck 13%, tặng 2 chỉ vàng o965172574","I–Tower, Phường Lý Thường Kiệt, Thành Phố Quy Nhơn, Bình Định",45,1.7,1,1,25,Tây bắc,,,,3944489
"Chính chủ bán ccmn nguyễn văn cừ 600tr/căn 1-2pn full nội thất,oto đỗ cửa","Quận Long Biên, Hà Nội",31,0.65,1,1,6,,,,,3414813
"Bán căn góc 85m2 the golden dynasty full nội thất, sổ hồng sẵn","TRƯƠNG PHƯỚC PHAN, Phường Bình Trị Đông, Quận Bình Tân, TP HCM",85,2.7,3,2,14,Nam,20,,,3944467
"Bán căn hộ 66m2 q. bình tân, sổ hồng sẵn, thanh toán 650tr ở ngay","TRƯƠNG PHƯỚC PHAN, Phường Bình Trị Đông, Quận Bình Tân, TP HCM",66,2.2,3,2,15,Đông,20,,,3944464
Căn hộ 75m2 hoàng kim thế gia sổ hồng sẵn tt 650tr ở ngay nội thất,"TRƯƠNG PHƯỚC PHAN, Phường Bình Trị Đông, Quận Bình Tân, TP HCM",75,2.45,3,2,12,Đông,20,,,3944458
The lines/ sở hữu vị trí trọng tâm và góc nhìn triệu đô giữa ecopark,"KĐT Ecopark, Xã Cửu Cao, Huyện Văn Giang, Hưng Yên",84,4,3,2,15,Đông nam,,,,3944456
"Căn hộ 2pn2wc full nội thất, trả trước 650tr ở ngay sổ hồng sẵn - hoàng kim","TRƯƠNG PHƯỚC PHAN, Phường Bình Trị Đông, Quận Bình Tân, TP HCM",62,2.15,2,2,15,Tây,20,,,3944455
"Căn góc 83m2 hoàng kim thế gia sổ hồng sẵn, thanh toán 700tr ở ngay","TRƯƠNG PHƯỚC PHAN, Phường Bình Trị Đông, Quận Bình Tân, TP HCM",83,2.55,3,2,3,Nam,20,,,3944449
"Chính chủ bán ngay, căn góc 3pn(87m2)tầng 6,bc đông nam.chỉ 4.1tỷ hc golden city","HC Golden City, Phường Bồ Đề, Quận Long Biên, Hà Nội",87,4.1,3,2,6,,,,1,3944444
Kệt tiền bán nhanh căn hộ 2pn giá 1tỷ980 bao mọi thuế phí,"Căn hộ City Gate Towers, Phường 16, Quận 8, TP HCM",72,1.98,2,2,27,,,,1,3944440
Bán căn hộ 2pn giá tốt thị trường quận 7 dành cho các thương gia,"Căn hộ Era Town, Phường Phú Mỹ, Quận 7, TP HCM",67,1.57,2,2,,,,,4,3944432
Bán toà căn hộ 4 tầng đường thạch lam sát biển,"Phường Phước Mỹ, Quận Sơn Trà, Đà Nẵng",81,10.5,,,4,,5,5,,3944414
Bán căn hộ mặt tiền an thượng đang kinh doanh,"Phường An Hải Bắc, Quận Sơn Trà, Đà Nẵng",69,85,,,3,,,5,,3944402
"Bán căn hộ hóc môn 3pn 2wc, sổ riêng, sở hữu trọn đời","Xã Bà Điểm, Huyện Hóc Môn, TP HCM",60,0.8,,,,,,,,3944372
"600 triệu, sở hữu ngay căn hộ cc tại le grand jardin - nh cho vay 70%, ls 0% 12","Chung cư Le Grand Jardin, Quận Long Biên, Hà Nội",65,2.1,2,2,15,Đông nam,,,4,3927685
"Bán căn 97m2, 3pn, bc đông nam, kđt sài đồng, view bể bơi, giá chỉ 3,34tỷ, ls 0%","Sài Đồng, Quận Long Biên, Hà Nội",97,3.34,3,2,,Đông nam,,,4,3933179
"2.280 tỷ sở hữu căn cc 73m2 tại eco city việt hưng, ko vay bank ck 16%/70%gtch","Căn hộ Eco City Việt Hưng, Quận Long Biên, Hà Nội",73,2.02,2,2,,,,,,3941975
Chỉ cần 500 triệu sở hữu căn hộ sống xanh thiết kế bền vững-nhận nhà ở ngay-65m2,"Chung cư Le Grand Jardin, Quận Long Biên, Hà Nội",65,2.08,2,2,,,,,,3941202
Cập nhật bảng hàng và chính sách mới căn hộ vina2 panorama quy nhơn,"Phường Nhơn Bình, Thành Phố Quy Nhơn, Bình Định",52,1.2,1,1,,Đông nam,,,,3944361
Tổng hợp quỹ căn eco city giá tốt từ 1.78 tỷ - 2.7 tỷ full nội thất cao cấp,"Căn hộ Eco City Việt Hưng, Quận Long Biên, Hà Nội",64,1.8,2,2,10,Đông nam,,,,3937519
"Hot. nhượng lại suất ngoại giao 2pn, giá chỉ từ 1,78 tỷ chiết khấu lên tới 300tr","Căn hộ Eco City Việt Hưng, Quận Long Biên, Hà Nội",64,1.78,2,2,10,Đông nam,,,,3936991
"Giá gốc từ cđt, bán căn góc 3pn dự án hc golden, 87m giá chỉ 3,6 tỷ nhận nhà","HC Golden City, Quận Long Biên, Hà Nội",87,3.6,,,15,Đông bắc,,,,3937916
"Giá gốc từ cđt, bán căn góc 3pn dự án hc golden, 87m giá chỉ 3,6 tỷ","Quận Long Biên, Hà Nội",87.3,3.6,3,2,,Đông nam,,,,3940517
"Quỹ căn ngoại giao dự án ecocity việt hưng 2n, 3n giá chỉ từ 1,78 tỷ, hỗ trợ vay","Căn hộ Eco City Việt Hưng, Quận Long Biên, Hà Nội",64,0.11392,2,2,10,Đông nam,,,,3934972
Chính chủ bán căn hộ chung cư mỹ đức phường 21 quận bình thạnh,"XÔ VIẾT NGHỆ TĨNH, Phường 21, Quận Bình Thạnh, TP HCM",95,3.6,2,2,20,,,,,3944362
Đặt trước căn hộ cao cấp dự án the lines tiềm năng nhất phía đông hn,"Xã Cửu Cao, Huyện Văn Giang, Hưng Yên",56,2.52,2,1,,Đông nam,25,,,3944360
"Chính chủ bán căn hộ everich ìninity, đã có sổ hồng vĩnh viễn","Căn hộ Everrich Infinity, Phường 4, Quận 5, TP HCM",80,5.8,2,2,,,,,,3944357
"Chính chủ cần bán căn hộ 2 phòng ngủ, 63m2, view vinhomes riverside","Giang Biên, Quận Long Biên, Hà Nội",63,0.0945,2,2,11,Đông nam,20,20,2,3940800
Giảm giá mùa dịch đên 7% khi mua căn hộ lavita thuận an trong tháng 7 duy nhất.,"Thị Xã Thuận An, Bình Dương",50,1.64,1,1,15,Đông nam,18,45,4,3933685
"Căn hộ q7 sài gon riverside mặt tiền đào trí, quận 7 giá tốt, hỗ trợ vay 50%","Saigon Riverside Complex, Quận 7, TP HCM",53,1.85,2,1,12,Tây,30,30,4,3928987
"Đầu tư chung cư biên hòa universe complex trúng xe mazda3, giảm giá 4%, trả góp.","Biên Hòa Universe Complex, TP Biên Hòa, Đồng Nai",74,2.3,2,2,17,Đông bắc,18,45,4,3931238
"Trúng xe ô tô mazda 3 khi mua căn hộ biên hòa univer complex, chỉ cần đóng 30%.","Biên Hòa Universe Complex, TP Biên Hòa, Đồng Nai",73,2.3,2,2,16,Tây Nam,15,45,4,3930421
Chung cư biên hòa universe complex 73m 2pn/2.2 tỷ bàn giao nội thất cao cấp.,"Biên Hòa Universe Complex, TP Biên Hòa, Đồng Nai",73,2.28,2,2,9,Nam,18,45,4,3927310
"Căn hộ quy nhơn melody giảm giá 3%, hoàn tiền 5%, cách biển 50m.","Quy Nhơn Melody Hưng Thịnh, Thành Phố Quy Nhơn, Bình Định",51,1.7,1,1,25,,30,,2,3810525
"Căn hộ lavita charm thủ đức ngã tư bình thái, nhận nhà 2021 hỗ trợ vay 70%","Quận Thủ Đức, TP HCM",67.3,2.4,2,2,20,Tây Nam,15,33,4,3821289
"Căn hộ 3pn biên hòa universe complex 85m2 giá chỉ 2,470tỷ trả góp 36 trợ vay 70%","TP Biên Hòa, Đồng Nai",85,2.47,3,2,26,Đông nam,18,45,3,3861398
"Mở bán căn hộ biên hòa universe complex tp biên hòa giá chỉ 1,9 ty/ 2pn 66m2.","TP Biên Hòa, Đồng Nai",66,1.9,2,2,18,,18,45,4,3855558
"Mở bán căn hộ hưng thịnh tp biên hòa cách lotte chỉ hơn 1km, chỉ 1,5 tỷ/căn","TP Biên Hòa, Đồng Nai",52,1.5,1,1,21,Đông bắc,45,45,4,3854220
"Căn hộ biên hòa universe hưng thịnh trung chỉ từ 1,550 tỷ/căn 54m2 trợ vay 70%","TP Biên Hòa, Đồng Nai",54,1.55,2,1,15,Đông,20,45,4,3848824
"Bán căn hộ new galaxy kề suối tiên, khu làng đại học 63m2/2pn giá chỉ 2,2 tỷ.","9X Next Gen, Thị Xã Dĩ An, Bình Dương",62,2.2,2,1,12,Đông nam,30,30,2,3846943
"Căn hộ cao cấp biên hòa universe mặt tiền xa lộ hà nội giá chỉ 32tr/m2, trả góp.","TP Biên Hòa, Đồng Nai",68,2.17,2,2,19,Đông,18,45,4,3854716
"Bán căn hộ q7 saigon riverside complex 2pn 67m2 giá chỉ 2,150 tỷ bao phí","Saigon Riverside Complex, Quận 7, TP HCM",67,2.15,2,2,29,Bắc,45,45,4,3875205
Căn hộ new galaxy tại khu làng đại học quốc gia tp hcm giá chỉ từ 32tr/m2,"Căn hộ làng đại học Thủ Đức, Thị Xã Dĩ An, Bình Dương",52,1.7,1,1,19,,15,32,1,3819964
Suất nội bộ căn 50.1m2 dự án new galaxy giảm 4% tổng giá kèm hoàn tiền thêm 5%.,"Căn hộ làng đại học Thủ Đức, Thị Xã Dĩ An, Bình Dương",50.11,1.56,,,9,Đông nam,15,33,,3806418
Căn hộ cao cấp lavita thành phố thuận an 70m² 2pn chỉ cần đóng 560tr ân hạn lãi,"Thị Xã Thuận An, Bình Dương",70,2.4,2,2,12,Đông nam,50,50,4,3926621
"Căn hộ lavita thuận an 90m²3pn chỉ đóng 30%,ck 2%, gía sau giảm trong tháng này.","Thị Xã Thuận An, Bình Dương",91,2.45,3,2,18,Tây Nam,50,50,4,3926631
Giảm giá đến 7% khi khách mua căn hộ lavita thuận an trong tháng 7 hoàn tiền 5%,"Astral City, Thị Xã Thuận An, Bình Dương",72,2.09,2,2,18,Đông nam,18,45,4,3938104
Chính chủ cần bán gấp chung cư lotus central bắc ninh- lý thái tổ -t12 căn 03a,"Lý Thái Tổ, TP. Bắc Ninh, Bắc Ninh",68,2.15,2,2,12,,40,,,3926553
"Tôi cần bán gấp cc nguyễn đức cảnh, 133m2, 4pn, 3vs, căn góc","Khu 151A Nguyễn Đức Cảnh, Quận Hoàng Mai, Hà Nội",133,2.65,3,2,18,Tây Nam,32,5,,3526727
Căn hộ veiw biển kiểu nhật chỉ từ 1 tỷ/ căn,"Quận Liên Chiểu, Đà Nẵng",45,1,3,2,21,Đông nam,27,27,,3944276
Mở bán quỹ căn mới tòa dv4 cực hot chỉ 1.8 tỷ căn 2 ngủ full đồ,"Rose Town, Quận Hoàng Mai, Hà Nội",65,1.8,,,,,,,,3944277
Mở bán chung cư housinco nguyễn xiển căn 3 ngủ 94m2 chỉ từ 3 tỷ,"Housinco Premium, Huyện Thanh Trì, Hà Nội",94,3,3,2,,Đông nam,,,,3939745
"Mở bán chung cư lavender 176 định công chỉ từ 1,6 tỷ/căn","Định Công, Quận Thanh Xuân, Hà Nội",65,2,2,,,,,,,3939748
"Dự án moonlight centre point kế aeon mall, trả góp 19 triệu/tháng không lãi suất","Moonlight Centre Point, Quận Bình Tân, TP HCM",36,1.9,1,1,24,,40,40,1,3942340
"Chỉ 900 triệu nhận nhà ở ngay. giá chỉ từ 22,5 tr/m2","KĐT Văn Khê, Quận Hà Đông, Hà Nội",107,2.6,3,3,26,Đông nam,10,,,3944272
Bài toán 1 tỷ sở hữu căn hộ đã được giải quyết. đóng 900tr nhận nhà ở 0968837420,"Quận Hà Đông, Hà Nội",136,3.1,3,3,26,Đông nam,10,,,3944151
Căn hộ cao cấp - đẳng cấp 5 sao tại felicia city,"Felicia City Bình Phước, Huyện Phú Riềng, Bình Phước",121,0.5,2,2,,,31,31,,3936419
Gia đình cần bán gấp căn góc full nội thất chung cư 7a lê đức thọ cầu giấy,"Quận Cầu Giấy, Hà Nội",85,2.4,2,1,17,Đông nam,30,,4,3944266
Gấp bán căn hộ 3 ngủ 136m2 hỗ trợ 900 triệu nhận nhà 0962374177,"Quận Hà Đông, Hà Nội",136,3,3,3,,Đông bắc,,,,3943392
Chính chủ muốn bán lại ngay trong tháng căn 3 pn . hỗ trợ vay bank 0962374177,"Quận Hà Đông, Hà Nội",135,3,3,3,,Đông bắc,,,,3943441
Còn duy nhất căn hộ siêu rẻ 3 phòng ngủ bán nhanh . 0962374177,"Quận Hà Đông, Hà Nội",135,3,3,3,,Đông bắc,,,,3941949
Gấp bán căn hộ 65m2 tầng 28 ưu đãi lãi suất đến tận cuối năm 2022.,"Quận Hà Đông, Hà Nội",65,1.8,2,2,,Tây Nam,,,,3939579
"Bán căn hộ 3 ngủ chính sách tốt nhất tòa , hỗ trợ thanh toán tiến độ 2 năm","Quận Hà Đông, Hà Nội",142,3.2,3,2,,Đông bắc,,,,3939433
Duy nhất căn hộ sân vườn trung tâm hà đông . miễn lãi đến cuối 2022.,"Quận Hà Đông, Hà Nội",80,2,2,2,,Đông bắc,,,,3939310
Duy nhất 1 căn 135 m2 giá ưu đãi bán nhanh trong tháng 7 - hỗ trợ vay bank,"Quận Hà Đông, Hà Nội",136,3,3,3,,Đông bắc,,,,3938314
Bán gấp căn hộ 136m2 3 ngủ 3vs nhận nhà từ 950 triệu. vay bank được 0962374177,"Quận Hà Đông, Hà Nội",136,3,3,3,,Đông nam,,,,3937729
Căn hộ 2 ngủ view đẹp hỗ trợ lãi suất 0% tại trung tâm hà đông . 0962374177,"Quận Hà Đông, Hà Nội",65,1.87,2,2,,Đông nam,,,,3937178
Chính chủ bán căn hộ- vinhome-skylake tòa nhà s3-1508-phạm hùng,"Phạm Hùng, Quận Nam Từ Liêm, Hà Nội",72,3.5,2,2,,Đông nam,,,,3928806
Hoàng Huy Grand Tower - Chung cư số *** 1 *** Hải Phòng,"Đường Hà Nội, Quận Hồng Bàng, Hải Phòng",63,Thỏa thuận,2,2,37,Tây bắc,40,,4,3942293
Chỉ 225trieu/25%/ căn ngay tp thuận an-bình dương,"Legacy Central, Thị Xã Thuận An, Bình Dương",48,0.9,2,1,29,,16,12,4,3941722
Tặng ngay 150tr 10 chỉ vàng khi đăng ký mua căn hộ picity q12,"Picity High Park, Quận 12, TP HCM",58,2.08,2,1,,,25,30,4,3944246
Căn hộ imperium cao cấp view biển tọa lạc tại phía nam tp nha trang,"Imperium Tower, Thành Phố Nha Trang, Khánh Hòa",40,1.6,1,1,39,Nam,20,,2,3932650
💥💥🌈hót Hót 🏙☘️☘️ căn hộ đẹp duy nhất còn được áp dụng ưu đãi trong đợt dịch này ạ,"KĐT Ecopark, Huyện Văn Giang, ",63.1,2.87,2,2,11,Bắc,30,8,2,3944240
Còn 3 suất ngoại giao dành cho khách mua căn hộ 2pn chung cư cao cấp the sang,"The Sang Residence, Quận Ngũ Hành Sơn, Đà Nẵng",82,0.827,2,2,,Đông nam,,,4,3944227
Quỹ hàng tốt nhất la fortuna - 300 căn 2pn - 3pn penthouse- nhìn trực diện tp,"La Fortuna, Thị Xã Vĩnh Yên, Vĩnh Phúc ",86,1.8,,,,Đông nam,,,,3944221
Căn hộ cao cấp giá rẻ ngay trung tâm thành phố thuận an,"Thị Xã Thuận An, Bình Dương",32,0.9,,,,,,,,3942486
Căn hộ chung cư ngay vòng xoay an phú thuận an,"Xã An Phú, Thị Xã Thuận An, Bình Dương",60,1.41,2,2,22,,,54,,3940939
Căn đẹp nhất dự án có trong giỏ hàng tháng 8 này,"Blue Sapphire Resort Vũng Tàu, Thành Phố Vũng Tàu, Bà Rịa - Vũng Tàu",110,4.3,2,2,12,Đông nam,,,4,3944189
